{
  "status": "illustrative-only-not-a-registered-wiring",
  "status_note": "D-09 form 3 — one worked trace instance of the LightRAG hybrid arm (lightrag-base.json + lightrag-arm-hybrid.json-patch.json, PARTS.md ### §L.2), validated by rig-check.sh against rig-trace.schema.json. This is the GR-1 side of D-11's worked comparison (vs. VT-1's naive arm). Never a registered wiring or a real measured run — every node_id is drawn from PARTS.md ### §L.1's published node table; every number below is a plausible, internally-consistent illustration, not a measurement. [inference]",
  "run_id": "run-9f1c2a4e-vt1-vs-gr1-hybrid",
  "wiring_id": "lightrag-base+lightrag-arm-hybrid",
  "wiring_instance_hash": "sha256:7f3c9a1e4b6d2f80c1a9d4e6b2f7c803",
  "arm_id": "hybrid",
  "arm_execution_order": 1,
  "bundle_ref": "eval-bundle@v0.1-vt1-vs-gr1-hybrid",
  "corpus_snapshot_hash": "sha256:corpus-9c88f21a7d3b5e60",
  "executor_version": "executor@0.1.0",
  "concurrency_setting": "sequential",
  "determinism_setting": "cache-bypassed",
  "stop_reason": null,
  "partial": false,
  "degraded": false,
  "degradation_reason": null,
  "nodes": [
    {
      "node_id": "keywords",
      "instance_hash": "sha256:node-keywords-1a2b3c4d5e6f",
      "depth": "stage",
      "effective_depth": "stage",
      "tier": "T2",
      "feed_tier": "T2",
      "wall_clock_ms": 452,
      "cache_hit": false,
      "guards_fired": [],
      "budget_state": "within_budget",
      "realised_budget_share": 0.86,
      "cross_process_failure_cause": null,
      "resumable": false,
      "tokens": {
        "prompt_tokens": 738,
        "completion_tokens": 42,
        "cached_read_tokens": 0,
        "call_count": 1,
        "counted_by": "tiktoken/cl100k_base@gpt-4o-mini"
      }
    },
    {
      "node_id": "embedder-query",
      "instance_hash": "sha256:node-embedder-query-2b3c4d5e6f7a",
      "depth": "stage",
      "effective_depth": "stage",
      "tier": "T2",
      "feed_tier": "T2",
      "wall_clock_ms": 118,
      "cache_hit": false,
      "guards_fired": [],
      "budget_state": "within_budget",
      "realised_budget_share": 0.91,
      "cross_process_failure_cause": null,
      "resumable": true,
      "tokens": {
        "prompt_tokens": 14,
        "completion_tokens": 0,
        "cached_read_tokens": 0,
        "call_count": 1,
        "counted_by": "tiktoken/cl100k_base@gpt-4o-mini"
      }
    },
    {
      "node_id": "entity-lookup",
      "instance_hash": "sha256:node-entity-lookup-3c4d5e6f7a8b",
      "depth": "stage",
      "effective_depth": "stage",
      "tier": "T1",
      "feed_tier": "T1",
      "wall_clock_ms": 34,
      "cache_hit": false,
      "guards_fired": [],
      "budget_state": "within_budget",
      "realised_budget_share": 0.0,
      "cross_process_failure_cause": null,
      "resumable": true,
      "tokens": {
        "prompt_tokens": 0,
        "completion_tokens": 0,
        "cached_read_tokens": 0,
        "call_count": 0,
        "counted_by": "tiktoken/cl100k_base@gpt-4o-mini"
      }
    },
    {
      "node_id": "entity-hydrate-expand",
      "instance_hash": "sha256:node-entity-hydrate-expand-4d5e6f7a8b9c",
      "depth": "stage",
      "effective_depth": "stage",
      "tier": "T1",
      "feed_tier": "T1",
      "wall_clock_ms": 61,
      "cache_hit": false,
      "guards_fired": [],
      "budget_state": "within_budget",
      "realised_budget_share": 0.0,
      "cross_process_failure_cause": null,
      "resumable": true,
      "tokens": {
        "prompt_tokens": 0,
        "completion_tokens": 0,
        "cached_read_tokens": 0,
        "call_count": 0,
        "counted_by": "tiktoken/cl100k_base@gpt-4o-mini"
      }
    },
    {
      "node_id": "relation-lookup",
      "instance_hash": "sha256:node-relation-lookup-5e6f7a8b9c0d",
      "depth": "stage",
      "effective_depth": "stage",
      "tier": "T1",
      "feed_tier": "T1",
      "wall_clock_ms": 33,
      "cache_hit": false,
      "guards_fired": [],
      "budget_state": "within_budget",
      "realised_budget_share": 0.0,
      "cross_process_failure_cause": null,
      "resumable": true,
      "tokens": {
        "prompt_tokens": 0,
        "completion_tokens": 0,
        "cached_read_tokens": 0,
        "call_count": 0,
        "counted_by": "tiktoken/cl100k_base@gpt-4o-mini"
      }
    },
    {
      "node_id": "relation-hydrate-expand",
      "instance_hash": "sha256:node-relation-hydrate-expand-6f7a8b9c0d1e",
      "depth": "stage",
      "effective_depth": "stage",
      "tier": "T1",
      "feed_tier": "T1",
      "wall_clock_ms": 58,
      "cache_hit": false,
      "guards_fired": [],
      "budget_state": "within_budget",
      "realised_budget_share": 0.0,
      "cross_process_failure_cause": null,
      "resumable": true,
      "tokens": {
        "prompt_tokens": 0,
        "completion_tokens": 0,
        "cached_read_tokens": 0,
        "call_count": 0,
        "counted_by": "tiktoken/cl100k_base@gpt-4o-mini"
      }
    },
    {
      "node_id": "join-entities",
      "instance_hash": "sha256:node-join-entities-7a8b9c0d1e2f",
      "depth": "stage",
      "effective_depth": "stage",
      "tier": "T1",
      "feed_tier": "T1",
      "wall_clock_ms": 2,
      "cache_hit": false,
      "guards_fired": [],
      "budget_state": "within_budget",
      "realised_budget_share": 0.0,
      "cross_process_failure_cause": null,
      "resumable": true,
      "tokens": {
        "prompt_tokens": 0,
        "completion_tokens": 0,
        "cached_read_tokens": 0,
        "call_count": 0,
        "counted_by": "tiktoken/cl100k_base@gpt-4o-mini"
      }
    },
    {
      "node_id": "join-relations",
      "instance_hash": "sha256:node-join-relations-8b9c0d1e2f3a",
      "depth": "stage",
      "effective_depth": "stage",
      "tier": "T1",
      "feed_tier": "T1",
      "wall_clock_ms": 2,
      "cache_hit": false,
      "guards_fired": [],
      "budget_state": "within_budget",
      "realised_budget_share": 0.0,
      "cross_process_failure_cause": null,
      "resumable": true,
      "tokens": {
        "prompt_tokens": 0,
        "completion_tokens": 0,
        "cached_read_tokens": 0,
        "call_count": 0,
        "counted_by": "tiktoken/cl100k_base@gpt-4o-mini"
      }
    },
    {
      "node_id": "budget-entities",
      "instance_hash": "sha256:node-budget-entities-9c0d1e2f3a4b",
      "depth": "stage",
      "effective_depth": "stage",
      "tier": "T1",
      "feed_tier": "T1",
      "wall_clock_ms": 4,
      "cache_hit": false,
      "guards_fired": [],
      "budget_state": "within_budget",
      "realised_budget_share": 0.0,
      "cross_process_failure_cause": null,
      "resumable": true,
      "tokens": {
        "prompt_tokens": 0,
        "completion_tokens": 0,
        "cached_read_tokens": 0,
        "call_count": 0,
        "counted_by": "tiktoken/cl100k_base@gpt-4o-mini"
      }
    },
    {
      "node_id": "budget-relations",
      "instance_hash": "sha256:node-budget-relations-0d1e2f3a4b5c",
      "depth": "stage",
      "effective_depth": "stage",
      "tier": "T1",
      "feed_tier": "T1",
      "wall_clock_ms": 4,
      "cache_hit": false,
      "guards_fired": [],
      "budget_state": "within_budget",
      "realised_budget_share": 0.0,
      "cross_process_failure_cause": null,
      "resumable": true,
      "tokens": {
        "prompt_tokens": 0,
        "completion_tokens": 0,
        "cached_read_tokens": 0,
        "call_count": 0,
        "counted_by": "tiktoken/cl100k_base@gpt-4o-mini"
      }
    },
    {
      "node_id": "chunk-sel-kg",
      "instance_hash": "sha256:node-chunk-sel-kg-1e2f3a4b5c6d",
      "depth": "stage",
      "effective_depth": "stage",
      "tier": "T1",
      "feed_tier": "T1",
      "wall_clock_ms": 47,
      "cache_hit": false,
      "guards_fired": [],
      "budget_state": "within_budget",
      "realised_budget_share": 0.0,
      "cross_process_failure_cause": null,
      "resumable": true,
      "tokens": {
        "prompt_tokens": 0,
        "completion_tokens": 0,
        "cached_read_tokens": 0,
        "call_count": 0,
        "counted_by": "tiktoken/cl100k_base@gpt-4o-mini"
      }
    },
    {
      "node_id": "join-chunks",
      "instance_hash": "sha256:node-join-chunks-2f3a4b5c6d7e",
      "depth": "stage",
      "effective_depth": "stage",
      "tier": "T1",
      "feed_tier": "T1",
      "wall_clock_ms": 1,
      "cache_hit": false,
      "guards_fired": [],
      "budget_state": "within_budget",
      "realised_budget_share": 0.0,
      "cross_process_failure_cause": null,
      "resumable": true,
      "tokens": {
        "prompt_tokens": 0,
        "completion_tokens": 0,
        "cached_read_tokens": 0,
        "call_count": 0,
        "counted_by": "tiktoken/cl100k_base@gpt-4o-mini"
      }
    },
    {
      "node_id": "heading-backfill",
      "instance_hash": "sha256:node-heading-backfill-3a4b5c6d7e8f",
      "depth": "stage",
      "effective_depth": "stage",
      "tier": "T1",
      "feed_tier": "T1",
      "wall_clock_ms": 9,
      "cache_hit": false,
      "guards_fired": [],
      "budget_state": "within_budget",
      "realised_budget_share": 0.0,
      "cross_process_failure_cause": null,
      "resumable": true,
      "tokens": {
        "prompt_tokens": 0,
        "completion_tokens": 0,
        "cached_read_tokens": 0,
        "call_count": 0,
        "counted_by": "tiktoken/cl100k_base@gpt-4o-mini"
      }
    },
    {
      "node_id": "rerank",
      "instance_hash": "sha256:node-rerank-4b5c6d7e8f9a",
      "depth": "stage",
      "effective_depth": "stage",
      "tier": "T1",
      "feed_tier": "T1",
      "wall_clock_ms": 187,
      "cache_hit": false,
      "guards_fired": [],
      "budget_state": "within_budget",
      "realised_budget_share": 0.72,
      "cross_process_failure_cause": null,
      "resumable": true,
      "tokens": {
        "prompt_tokens": 2140,
        "completion_tokens": 0,